{
  "action": "store",
  "type": "semantic",
  "content": "SERVICE_API_KEY = BLOCKED_TEST_VALUE_NOT_A_SECRET",
  "source_refs": [
    {
      "kind": "file",
      "ref": "test/fixtures/source-refs/source-a.md",
      "status": "verified"
    }
  ],
  "evidence": { "status": "verified" },
  "sensitivity": "internal",
  "target_store": "backend-local"
}

